{"schema_version":"aid-test-profile-v1","run_unit_id":"bats:plugins/aid-orchestrator/scripts/tests/bats/test-aid-test-audit-config","runner":"bats","complete":true,"incomplete_reason":null,"elapsed_ms":2922,"exit_code":0,"budget_seconds":300,"lower_bound_ms":null,"timing":{"run_unit_id":"bats:plugins/aid-orchestrator/scripts/tests/bats/test-aid-test-audit-config","bats_version":"1.8.2","planned":6,"truncated":false,"parsed_lines":6,"cases":[{"ordinal":1,"name":"load_test_audit_config: config-absent path returns the exact hardcoded defaults, schema-valid","status":"passed","duration_ms":230},{"ordinal":2,"name":"load_test_audit_config: a present, valid config overrides the defaults correctly","status":"passed","duration_ms":501},{"ordinal":3,"name":"load_test_audit_config: a malformed present config fails closed with a named error, never a silent default fallback","status":"passed","duration_ms":398},{"ordinal":4,"name":"load_test_audit_config: fails closed (never silently accepts) a malformed present config when the schema validator is unavailable","status":"passed","duration_ms":118},{"ordinal":5,"name":"load_test_audit_config: an unparseable YAML file fails closed, never silently substitutes defaults","status":"passed","duration_ms":134},{"ordinal":6,"name":"load_test_audit_config: max_read_only_audit_agents is never read/written by code touching dispatch.max_parallel or dispatch.worktrees.max_parallel","status":"passed","duration_ms":120}]},"cost_curve":{"detected":false,"first_quartile_ms":null,"last_quartile_ms":null,"ratio":null,"note":"too few timed cases to distinguish growth from noise"},"source_signals":{"git_invocations":0,"explicit_sleeps":0,"retry_or_wait_loops":0,"subprocess_substitutions":2},"duplicate_membership":{"gates":[],"duplicated":false},"root_cause":{"bucket":"test_body","confidence":"medium","reason":"no rising cost, no duplicate membership and no wait constructs — the cost appears to be the behaviour under test","next_probe":null},"evidence_log":"bats_plugins_aid-orchestrator_scripts_tests_bats_test-aid-test-audit-config.log","evidence_log_sha256":"8553a73276630dc02737362f614257d3cfe3da56b86db8ef370c4aa7dc040ae6","audit_id":"e2e-1785759557","cancelled":false,"job":{"id":"profile-00f4f991-d-orchestrator_scripts_tests_bats_test-aid-test-audit-config","state":"terminal_pass","live_log":"/tmp/claude-1000/-opt-eco-projects-aid-orchestrator/fceea7f1-bc28-44a6-8212-974e4b4cda61/scratchpad/e2e-work/out/profile-jobs/profile-00f4f991-d-orchestrator_scripts_tests_bats_test-aid-test-audit-config/stdout.log"},"evidence_log_truncated":false,"evidence_log_dropped_bytes":0}
